{
  "$schema": "./migration-verification-receipt.schema.json",
  "schemaVersion": 1,
  "receiptType": "dated-verification-evidence",
  "verifiedAt": "2026-08-08T23:14:56.835Z",
  "purpose": "A non-normative receipt of exact successor metadata read from immutable authority commits; the authority repositories remain the sources of truth.",
  "claims": {
    "normativeSource": false,
    "provesRatification": false,
    "authorizesLegacyDeletion": false
  },
  "verification": {
    "sourceKind": "pinned-authority-bytes",
    "retrieval": "GitHub Git Data API tree and blob endpoints at exact commits; local Studio git objects at the exact commit",
    "digestMethod": "Git blob SHA-1 over exact bytes plus SHA-256 over exact file and parsed principle-block bytes",
    "ledgerWasNotInput": true,
    "liveCommand": "pnpm principles:verify-live"
  },
  "refresh": {
    "requiredWhen": "Any authority commit, successor path, stable ID, Status, Legacy inputs field, or source bytes change.",
    "procedure": "Resolve new immutable authority commits, fetch their Git trees and blobs, semantically review Legacy inputs, regenerate this receipt from those bytes, run offline validation, then run the live verifier with authenticated read access.",
    "offlineLimit": "Offline CI proves ledger and receipt structure, receipt integrity, local bytes, selected reciprocal mappings, and Draft deletion gates. It cannot prove that a private remote still serves the recorded bytes; the authenticated live verifier does that."
  },
  "legacyCatalogBaseline": {
    "repository": "jrmoulckers/studio",
    "commit": "efe6aa3b5ad020331a91f533844b0b9f70d70b76",
    "realmFiles": 21,
    "topLevelPrinciples": 192,
    "ids": [
      "studio-legacy:accessibility:1",
      "studio-legacy:accessibility:2",
      "studio-legacy:accessibility:3",
      "studio-legacy:accessibility:4",
      "studio-legacy:accessibility:5",
      "studio-legacy:accessibility:6",
      "studio-legacy:accessibility:7",
      "studio-legacy:ai-process:1",
      "studio-legacy:ai-process:2",
      "studio-legacy:ai-process:3",
      "studio-legacy:ai-process:4",
      "studio-legacy:ai-process:5",
      "studio-legacy:ai-process:6",
      "studio-legacy:ai-process:7",
      "studio-legacy:ai-process:8",
      "studio-legacy:ai-process:9",
      "studio-legacy:ai-process:10",
      "studio-legacy:ai-process:11",
      "studio-legacy:ai-process:12",
      "studio-legacy:ai-process:13",
      "studio-legacy:ai-process:14",
      "studio-legacy:ai-process:15",
      "studio-legacy:ai-process:16",
      "studio-legacy:ai-process:17",
      "studio-legacy:ai-process:18",
      "studio-legacy:ai-process:19",
      "studio-legacy:ai-process:20",
      "studio-legacy:ai-process:21",
      "studio-legacy:ai-process:22",
      "studio-legacy:ai-products:1",
      "studio-legacy:ai-products:2",
      "studio-legacy:ai-products:3",
      "studio-legacy:ai-products:4",
      "studio-legacy:ai-products:5",
      "studio-legacy:ai-products:6",
      "studio-legacy:ai-products:7",
      "studio-legacy:ai-products:8",
      "studio-legacy:architecture:1",
      "studio-legacy:architecture:2",
      "studio-legacy:architecture:3",
      "studio-legacy:architecture:4",
      "studio-legacy:architecture:5",
      "studio-legacy:architecture:6",
      "studio-legacy:architecture:7",
      "studio-legacy:architecture:8",
      "studio-legacy:architecture:9",
      "studio-legacy:architecture:10",
      "studio-legacy:architecture:11",
      "studio-legacy:architecture:12",
      "studio-legacy:architecture:13",
      "studio-legacy:architecture:14",
      "studio-legacy:architecture:15",
      "studio-legacy:backend:1",
      "studio-legacy:backend:2",
      "studio-legacy:backend:3",
      "studio-legacy:backend:4",
      "studio-legacy:backend:5",
      "studio-legacy:backend:6",
      "studio-legacy:backend:7",
      "studio-legacy:business:1",
      "studio-legacy:business:2",
      "studio-legacy:business:3",
      "studio-legacy:business:4",
      "studio-legacy:business:5",
      "studio-legacy:business:6",
      "studio-legacy:compliance:1",
      "studio-legacy:compliance:2",
      "studio-legacy:compliance:3",
      "studio-legacy:compliance:4",
      "studio-legacy:compliance:5",
      "studio-legacy:compliance:6",
      "studio-legacy:compliance:7",
      "studio-legacy:compliance:8",
      "studio-legacy:data-analytics:1",
      "studio-legacy:data-analytics:2",
      "studio-legacy:data-analytics:3",
      "studio-legacy:data-analytics:4",
      "studio-legacy:data-analytics:5",
      "studio-legacy:data-analytics:6",
      "studio-legacy:data-analytics:7",
      "studio-legacy:design:1",
      "studio-legacy:design:2",
      "studio-legacy:design:3",
      "studio-legacy:design:4",
      "studio-legacy:design:5",
      "studio-legacy:design:6",
      "studio-legacy:design:7",
      "studio-legacy:design:8",
      "studio-legacy:design:9",
      "studio-legacy:design:10",
      "studio-legacy:design:11",
      "studio-legacy:design:12",
      "studio-legacy:design:13",
      "studio-legacy:devops:1",
      "studio-legacy:devops:2",
      "studio-legacy:devops:3",
      "studio-legacy:devops:4",
      "studio-legacy:devops:5",
      "studio-legacy:devops:6",
      "studio-legacy:devops:7",
      "studio-legacy:devops:8",
      "studio-legacy:devops:9",
      "studio-legacy:devops:10",
      "studio-legacy:devops:11",
      "studio-legacy:devops:12",
      "studio-legacy:devops:13",
      "studio-legacy:devops:14",
      "studio-legacy:devops:15",
      "studio-legacy:documentation:1",
      "studio-legacy:documentation:2",
      "studio-legacy:documentation:3",
      "studio-legacy:documentation:4",
      "studio-legacy:documentation:5",
      "studio-legacy:documentation:6",
      "studio-legacy:documentation:7",
      "studio-legacy:featuring:1",
      "studio-legacy:featuring:2",
      "studio-legacy:featuring:3",
      "studio-legacy:featuring:4",
      "studio-legacy:featuring:5",
      "studio-legacy:featuring:6",
      "studio-legacy:featuring:7",
      "studio-legacy:frontend:1",
      "studio-legacy:frontend:2",
      "studio-legacy:frontend:3",
      "studio-legacy:frontend:4",
      "studio-legacy:frontend:5",
      "studio-legacy:frontend:6",
      "studio-legacy:frontend:7",
      "studio-legacy:frontend:8",
      "studio-legacy:frontend:9",
      "studio-legacy:local-first:1",
      "studio-legacy:local-first:2",
      "studio-legacy:local-first:3",
      "studio-legacy:local-first:4",
      "studio-legacy:localization:1",
      "studio-legacy:localization:2",
      "studio-legacy:localization:3",
      "studio-legacy:localization:4",
      "studio-legacy:localization:5",
      "studio-legacy:localization:6",
      "studio-legacy:localization:7",
      "studio-legacy:localization:8",
      "studio-legacy:localization:9",
      "studio-legacy:middleware:1",
      "studio-legacy:middleware:2",
      "studio-legacy:middleware:3",
      "studio-legacy:middleware:4",
      "studio-legacy:middleware:5",
      "studio-legacy:middleware:6",
      "studio-legacy:middleware:7",
      "studio-legacy:performance:1",
      "studio-legacy:performance:2",
      "studio-legacy:performance:3",
      "studio-legacy:performance:4",
      "studio-legacy:performance:5",
      "studio-legacy:performance:6",
      "studio-legacy:performance:7",
      "studio-legacy:performance:8",
      "studio-legacy:performance:9",
      "studio-legacy:process:1",
      "studio-legacy:process:2",
      "studio-legacy:process:3",
      "studio-legacy:process:4",
      "studio-legacy:process:5",
      "studio-legacy:process:6",
      "studio-legacy:process:7",
      "studio-legacy:project-planning:1",
      "studio-legacy:project-planning:2",
      "studio-legacy:project-planning:3",
      "studio-legacy:project-planning:4",
      "studio-legacy:project-planning:5",
      "studio-legacy:project-planning:6",
      "studio-legacy:project-planning:7",
      "studio-legacy:security:1",
      "studio-legacy:security:2",
      "studio-legacy:security:3",
      "studio-legacy:security:4",
      "studio-legacy:security:5",
      "studio-legacy:security:6",
      "studio-legacy:security:7",
      "studio-legacy:security:8",
      "studio-legacy:testing:1",
      "studio-legacy:testing:2",
      "studio-legacy:testing:3",
      "studio-legacy:testing:4",
      "studio-legacy:testing:5",
      "studio-legacy:testing:6",
      "studio-legacy:testing:7",
      "studio-legacy:testing:8",
      "studio-legacy:testing:9",
      "studio-legacy:testing:10"
    ]
  },
  "legacySourceSnapshot": {
    "repository": "jrmoulckers/studio",
    "commit": "20dc8e0119d8ee46bd3ec26643f1b21a3eca8df0",
    "realmFiles": 21,
    "topLevelPrinciples": 192,
    "files": [
      {
        "path": "principles/accessibility.md",
        "blobSha": "3c1f22d4d8d1a2fa3bb943122aebaac60687d1d5",
        "sha256": "a83620df9961d8c564010e5cc83b27a7b3287b335d2beaf84c566c2b5c46191f",
        "topLevelIds": [
          "studio-legacy:accessibility:1",
          "studio-legacy:accessibility:2",
          "studio-legacy:accessibility:3",
          "studio-legacy:accessibility:4",
          "studio-legacy:accessibility:5",
          "studio-legacy:accessibility:6",
          "studio-legacy:accessibility:7"
        ]
      },
      {
        "path": "principles/ai-process.md",
        "blobSha": "1bea65c83d75aa4f26daaedcce729700175cc080",
        "sha256": "74965045624c55b71b331e2abb57379689c9ba3dfcaa5e2d5b6f71d037441d75",
        "topLevelIds": [
          "studio-legacy:ai-process:1",
          "studio-legacy:ai-process:2",
          "studio-legacy:ai-process:3",
          "studio-legacy:ai-process:4",
          "studio-legacy:ai-process:5",
          "studio-legacy:ai-process:6",
          "studio-legacy:ai-process:7",
          "studio-legacy:ai-process:8",
          "studio-legacy:ai-process:9",
          "studio-legacy:ai-process:10",